1000|aa
1000|aafdaf
1000|qured
1000|jjj aa
1000|vafasfsa aafdaf
1000|ajaldal
1000|hhh aa
1000|qwqwrqw 
1000|a
200|Cách giải quyết bảo hiểm khi công ty bị thua lỗ
200|Cách giải quyết khi công ty bị thua lỗ
200|Cách giải quyết khi công ty phá sản
200|Nếu công ty bị phá sản
200|Nếu công ty bị thua lỗ
200|Cách giải quyết bảo hiểm khi công ty mất khả năng chi trả
200|Cách giải quyết bảo hiểm khi công ty không có khả năng chi trả
200|Cách giải quyết bảo hiểm khi công ty không thể chi trả
200|Cách giải quyết bảo hiểm khi công ty bị thua lỗ hoặc phá sản
201|Với giá trị đảm bảo của công ty có thể so với tình hình lạm phát hiện nay như thế nào
201|Tình hình lạm phát ảnh hưởng đến việc đảm bảo bảo hiểm của công ty thế nào
201|Bảo hiểm đảm bảo cho công ty khi có lạm phát
201|Bảo hiểm so với lạm phát
201|bảo hiểm khi có lạm phát
201|Tình hình lạm phát ảnh hưởng đến việc đảm bảo bảo hiểm của công ty thế nào
201|Bảo hiểm đảm bảo cho công ty khi có lạm phát
202|Thủ tục Hồ sơ bên Metlife khác BIC thế nào
202|Bảo hiểm bên BIC và Metlife khác nhau như thế nào
202|Bảo hiểm bên BIC và Metlife khác nhau
202|Thủ tục Hồ sơ bên BIC và Metlife khác nhau như thế nào
202|Tính chất bảo hiểm bên BIC và Metlife khác nhau như thế nào
203|Khám thẩm định
203|Tại sao phải đi khám sức khoẻ
203|Tại sao khám sức khoẻ
203|Khám sức khỏe
203|Tại sao lại phải đi khám
204|Chỉ định người thụ hưởng
205|Bảo hiểm tử kỳ
205|Sản phẩm bảo hiểm tử kỳ
206|Bổ trợ tai nạn tăng cường
206|Bổ trợ tai nạn cá nhân
206|Bổ trợ tai nạn
206|sản phẩm này là gì
220|bảo hiểm
220|bảo hiểm là gì
221|doanh nghiệp bảo hiểm
221|công ty bảo hiểm
221|cong ti bao hiem
222|đại lý bảo hiểm
222|đại lí bảo hiểm
223|BIDV MetLife là công ty nào
223|MetLife là ở đâu
223|MetLife là công ty quốc tế à
223|MetLife là gì
223|MetLife là công ty nào
500|Đồ ngu
500|Đồ dở hơi
500|Vớ vẫn
500|Ngu như lợn
500|Ngu như bò
500|Ngu như chó
500|Mất thời gian
500|Vứt mẹ nó đi
500|D mẹ
500|Như cứt ý
500|Đồ điên
500|Ngu lắm
500|Dốt
1|Tôi có được hoàn phí nếu hủy hợp đồng không
1|Nếu huỷ hợp đồng có được hoàn phí không
1|Huỷ hợp đồng có hoàn phí
1|Huỷ hợp đồng hoàn phí
1|Huỷ hợp đồng
1|Huỷ bảo hiểm
1|Hoàn phí huỷ hợp đồng
1|Hoàn phí
1|Có hoàn phí khi huỷ hợp đồng
1|có hoàn phí huỷ hợp đồng
1|có được hoàn phí huỷ hợp đồng
1|Tôi có được hoàn phí nếu hủy hd
1|Nếu huỷ hd có được hoàn phí không
1|Huỷ hd có hoàn phí
1|Huỷ hd hoàn phí
1|Huỷ hd
1|Huỷ bh
1|Hoàn phí huỷ hd
1|Hoàn phí
1|Có hoàn phí khi huỷ hợp đồng
1|có hoàn phí huỷ hợp đồng
1|có được hoàn phí huỷ hợp đồng
2|Tôi có thể thay đổi hợp đồng bảo hiểm được không
2|Có thể thay đổi hợp đồng bảo hiểm
2|Thay đổi hợp đồng bảo hiểm
2|hợp đồng bảo hiểm thay đổi
2|thay đổi bảo hiểm
2|bảo hiểm thay đổi
2|Tôi có thể thay đổi hd bảo hiểm được không
2|Có thể thay đổi hd bảo hiểm
2|Thay đổi hd bảo hiểm
2|hd bảo hiểm thay đổi
2|thay đổi bh
2|bh thay đổi
2|Tôi có thể thay đổi hd bh được không
2|Có thể thay đổi hd bh
2|Thay đổi hd bh
2|hd bh thay đổi
2|thay đổi bh
2|bh thay đổi
3|Tôi có thể mua hợp đồng bảo hiểm cho cán bộ chủ chốt của công ty tôi không
3|Mua hợp đồng bảo hiểm công ty
3|Mua hợp đồng bảo hiểm cho cán bộ
3|Mua bảo hiểm công ty
3|Mua bảo hiểm cán bộ
3|Tôi có thể mua hd bh cho cán bộ chủ chốt của công ty tôi không
3|Mua hợp đồng bảo hiểm công ty
3|Mua hợp đồng bh cho cán bộ
3|Mua bh công ty
3|Mua bh cán bộ
3|Mua hd bh
4|Điều gì sẽ xảy ra khi tình trạng sức khỏe của tôi thay đổi
4|Nếu sức khoẻ thay đổi
4|Nếu tình trạng sức khoẻ thay đổi
4|Nếu sức khoẻ tình trạng thay đổi
4|Thay đổi sức khoẻ
4|Sức khoẻ thay đổi
4|Tình trạng sức khoẻ thay đổi
5|Vợ/chồng của tôi có được hưởng quyền lợi bảo hiểm của tôi không
5|Vợ hưởng quyền lợi bảo hiểm
5|Chồng hưởng quyền lợi bảo hiểm
5|Ai là người được hưởng quyền lợi bảo hiểm
5|ai la nguoi duoc huong bao hiem
5|Vợ/chồng của tôi có được hưởng quyền lợi bh của tôi không
5|Vợ hưởng quyền lợi bh
5|Chồng hưởng quyền lợi bh
5|Ai là người được hưởng quyền lợi bh
5|ai la nguoi duoc huong bh
6|Làm sao để tôi giải quyết quyền lợi bảo hiểm
6|Giải quyết quyền lợi bảo hiểm
6|quyền lợi bảo hiểm yêu cầu
6|thủ tục quyền lợi bảo hiểm
6|thủ tục yêu cầu quyền lợi bảo hiểm
6|Làm sao để tôi giải quyết quyền lợi bh
6|Giải quyết quyền lợi bh
6|quyền lợi bh yêu cầu
6|thủ tục quyền lợi bh
6|thủ tục yêu cầu quyền lợi bh
6|thủ tục giải quyết bảo hiểm
6|thủ tục giải quyết bh
7|Sẽ thế nào nếu tôi chậm trả phí bảo hiểm
7|chậm trả phí bảo hiểm
7|trả chậm phí
7|trả chậm phí bảo hiểm
7|nếu chậm phí bảo hiểm
7|nếu chậm trả phí bảo hiểm
7|nếu trả chậm phí bảo hiểm
7|Sẽ thế nào nếu tôi chậm trả phí bh
7|chậm trả phí bh
7|trả chậm phí
7|trả chậm phí bh
7|nếu chậm phí bh
7|nếu chậm trả phí bh
7|nếu trả chậm phí bh
8|Phí bảo hiểm của tôi có tăng sau mỗi năm không
8|tăng phí bảo hiểm
8|tăng phí bảo hiểm hàng năm
8|phí bảo hiểm tăng hàng năm
8|phí bảo hiểm tăng mỗi năm
8|mỗi năm tăng phí bảo hiểm
8|Phí bh của tôi có tăng sau mỗi năm không
8|tăng phí bh
8|tăng phí bh hàng năm
8|phí bh tăng hàng năm
8|phí bh tăng mỗi năm
8|mỗi năm tăng phí bh
9|Sẽ thế nào nếu tôi làm mất giấy tờ hợp đồng bảo hiểm
9|mất giấy tờ bảo hiểm
9|mất hợp đồng bảo hiểm
9|mất giấy tờ hợp đồng bảo hiểm
9|hợp đồng bảo hiểm mất
9|hợp đồng bảo hiểm bị mất
9|giấy tờ hợp đồng bảo hiểm bị mất
9|Sẽ thế nào nếu tôi làm mất giấy tờ hợp đồng bh
9|mất giấy tờ bh
9|mất hợp đồng bh
9|mất giấy tờ hợp đồng bh
9|hợp đồng bh mất
9|hợp đồng bh bị mất
9|giấy tờ hợp đồng bh bị mất
9|Sẽ thế nào nếu tôi làm mất giấy tờ hd bh
9|mất giấy tờ bh
9|mất hd bh
9|mất giấy tờ hd bh
9|hd bh mất
9|hd bh bị mất
9|giấy tờ hd bh bị mất
10|Mẫu đơn ỦY QUYỀN XÁC MINH THÔNG TIN
10|mẫu đơn uỷ quyền xác minh thông tin
10|đơn Ủy quyền xác minh thông tin
10|mẫu yêu cầu xácc minh thong tin
11|Phiếu yêu cầu giải quyết quyền lợi bảo hiểm
11|yêu cầu giải quyết quyền lợi bảo hiểm
11|yêu cầu giải quyết bảo hiểm
11|don yêu cầu giải quyết quyền lợi
11|đơn yêu cầu giải quyết bảo hiểm
11|mau giai quyet quyen loi bao hiem
11|don giai quyet quyen loi bao hiem
11|phieu giai quyet quyen loi bao hiem
11|Phiếu yêu cầu giải quyết quyền lợi bh
11|PHIẾU YÊU CẦU GIẢI QUYẾT QUYỀN LỢI BH
11|yêu cầu giải quyết quyền lợi bh
11|yêu cầu giải quyết quyền lợi bh
11|yeu cau giai quyet quyen loi
11|yeu cau giai quyet bh
11|yêu cầu giải quyết bh
11|yeu cau giai quyet quyen loi bh
11|don yêu cầu giải quyết quyền lợi
11|don yeu cau giai quyet quyen loi
11|don yeu cau giai quyet bh
11|đơn yêu cầu giải quyết bh
11|mau giai quyet quyen loi bh
11|don giai quyet quyen loi bh
11|phieu giai quyet quyen loi bh
12|phiếu Điều chỉnh thông tin hợp đồng bảo hiểm
12|đơn điều chỉnh thông tin hợp đồng bảo hiểm
12|mẫu Điều chỉnh thông tin hợp đồng bảo hiểm
12|phiếu Điều chỉnh thông tin hợp đồng bh
12|phiếu Điều chỉnh thông tin hợp đồng bh
12|đơn điều chỉnh thông tin hợp đồng bh
12|don dieu chinh thong tin hop dong
12|don dieu chinh thong tin hop dong bh
12|phieu dieu chinh thong tin hop dong bh
12|phieu dieu chinh thong tin hop dong
12|don dieu chinh hop dong
12|don dieu chinh hop dong bh
12|don dieu chinh thong tin bh
12|mau dieu chinh hop dong
12|mau dieu chinh hop dong bh
12|mau dieu chinh thong tin bh
12|mẫu Điều chỉnh thông tin hợp đồng bh
13|Mức phí bảo hiểm
13|Phải đóng bao nhiêu
13|Phải đóng bao nhiêu hàng tháng
13|Phải đóng bao nhiêu hàng năm
13|Số tiền phải đóng
13|Tiền phải đóng
13|Phải nộp bao nhiêu
13|Phí tham gia thế nào
14|thương tật toàn bộ vĩnh viễn
14|thương tật toàn bộ vĩnh viễn là gì
14|thương tật toàn phần vĩnh viễn là gì
14|thương tật thế nào thì được xem là thương tật toàn bộ vĩnh viễn
15|Thương tật một phần vĩnh viễn
15|Thương tật một phần vĩnh viễn là sao
15|thương tật thế nào thì được xem là thương tật một phần vĩnh viễn
16|Tai nạn là gì
16|Thế nào được coi là tai nạn
16|Tai nạn
16|Tai nạn được hiểu thế nào
17|Tai nạn giao thông công cộng
18|Cảm ơn
18|Thanks
18|thank
1000|aa
1000|aafdaf
1000|qured
1000|jjj aa
1000|vafasfsa aafdaf
1000|ajaldal
1000|hhh aa
1000|qwqwrqw 
1000|a
200|Cach giai quyet bao hiem khi cong ty bi thua lo
200|Cach giai quyet khi cong ty bi thua lo
200|Cach giai quyet khi cong ty pha san
200|Neu cong ty bi pha san
200|Neu cong ty bi thua lo
200|Cach giai quyet bao hiem khi cong ty mat kha nang chi tra
200|Cach giai quyet bao hiem khi cong ty khong co kha nang chi tra
200|Cach giai quyet bao hiem khi cong ty khong the chi tra
200|Cach giai quyet bao hiem khi cong ty bi thua lo hoac pha san
201|Vói giá trị dảm bảo của công ty có thẻ so vói tình hình lạm phát hiên nay như thé nào
201|Tinh hinh lam phat anh huong den viec dam bao bao hiem cua cong ty the nao
201|Bao hiem dam bao cho cong ty khi co lam phat
201|Bao hiem so voi lam phat
201|bao hiem khi co lam phat
201|Tinh hinh lam phat anh huong den viec dam bao bao hiem cua cong ty the nao
201|Bao hiem dam bao cho cong ty khi co lam phat
202|Thu tuc Ho so ben Metlife khac BIC the nao
202|Bao hiem ben BIC va Metlife khac nhau nhu the nao
202|Bao hiem ben BIC va Metlife khac nhau
202|Thu tuc Ho so ben BIC va Metlife khac nhau nhu the nao
202|Tinh chat bao hiem ben BIC va Metlife khac nhau nhu the nao
203|Kham tham dinh
203|Tai sao phai di kham suc khoe
203|Tai sao kham suc khoe
203|Kham suc khoe
203|Tai sao lai phai di kham
204|Chi dinh nguoi thu huong
205|Bao hiem tu ky
205|San pham bao hiem tu ky
206|Bo tro tai nan tang cuong
206|Bo tro tai nan ca nhan
206|Bo tro tai nan
206|san pham nay la gi
220|bao hiem
220|bao hiem la gi
221|doanh nghiep bao hiem
221|cong ty bao hiem
221|cong ti bao hiem
222|dai ly bao hiem
222|dai li bao hiem
223|BIDV MetLife la cong ty nao
223|MetLife la o dau
223|MetLife la cong ty quoc te a
223|MetLife la gi
223|MetLife la cong ty nao
500|Do ngu
500|Do do hoi
500|Vo van
500|Ngu nhu lon
500|Ngu nhu bo
500|Ngu nhu cho
500|Mat thoi gian
500|Vut me no di
500|D me
500|Nhu cut y
500|Do dien
1|Toi co duoc hoan phi neu huy hop dong khong
1|Neu huy hop dong co duoc hoan phi khong
1|Huy hop dong co hoan phi
1|Huy hop dong hoan phi
1|Huy hop dong
1|Huy bao hiem
1|huy bao hiem
1|Hoan phi huy hop dong
1|Hoan phi
1|Co hoan phi khi huy hop dong
1|co hoan phi huy hop dong
1|co duoc hoan phi huy hop dong
1|Toi co duoc hoan phi neu huy hd
1|Neu huy hd co duoc hoan phi khong
1|Huy hd co hoan phi
1|Huy hd hoan phi
1|Huy hd
1|Huy bh
1|Hoan phi huy hd
2|Toi co the thay doi hop dong bao hiem duoc khong
2|Co the thay doi hop dong bao hiem
2|Thay doi hop dong bao hiem
2|hop dong bao hiem thay doi
2|thay doi bao hiem
2|bao hiem thay doi
2|thay doi hop dong
2|Toi co the thay doi hd bao hiem duoc khong
2|Co the thay doi hd bao hiem
2|Thay doi hd bao hiem
2|hd bao hiem thay doi
2|thay doi bh
2|bh thay doi
2|Toi co the thay doi hd bh duoc khong
2|Co the thay doi hd bh
2|Thay doi hd bh
2|hd bh thay doi
2|thay doi bh
2|bh thay doi
3|Toi co the mua hop dong bao hiem cho can bo chu chot cua cong ty toi khong
3|Mua hop dong bao hiem cong ty
3|Mua hop dong bao hiem cho can bo
3|Mua bao hiem cong ty
3|Mua bao hiem can bo
3|Toi co the mua hd bh cho can bo chu chot cua cong ty toi khong
3|Mua hop dong bao hiem cong ty
3|Mua hop dong bh cho can bo
3|Mua bh cong ty
3|Mua bh can bo
3|Mua hd bh
4|Dieu gi se xay ra khi tinh trang suc khoe cua toi thay doi
4|Neu suc khoe thay doi
4|Neu tinh trang suc khoe thay doi
4|Neu suc khoe tinh trang thay doi
4|Thay doi suc khoe
4|Suc khoe thay doi
4|suc khoe thay doi thi sao
4|sức khoẻ thay đổi thì sao
4|Tinh trang suc khoe thay doi
5|Vo/chong cua toi co duoc huong quyen loi bao hiem cua toi khong
5|Vo huong quyen loi bao hiem
5|Chong huong quyen loi bao hiem
5|huong quyen loi bao hiem
5|hưởng quyền lợi bảo hiểm
5|huong bao hiem
5|hưởng bảo hiểm
5|hưởng bh
5|Vo/chong cua toi co duoc huong quyen loi bh cua toi khong
5|Vo huong quyen loi bh
5|Chong huong quyen loi bh
5|Ai la nguoi duoc huong quyen loi bh
5|ai la nguoi duoc huong bh
6|Lam sao de toi giai quyet quyen loi bao hiem
6|Giai quyet quyen loi bao hiem
6|quyen loi bao hiem yeu cau
6|thu tuc quyen loi bao hiem
6|thu tuc yeu cau quyen loi bao hiem
6|Lam sao de toi giai quyet quyen loi bh
6|Giai quyet quyen loi bh
6|quyen loi bh yeu cau
6|thu tuc quyen loi bh
6|thu tuc yeu cau quyen loi bh
6|thu tuc giai quyet bao hiem
6|thu tuc giai quyet bh
7|Se the nao neu toi cham tra phi bao hiem
7|cham tra phi bao hiem
7|tra cham phi
7|tra cham phi bao hiem
7|neu cham phi bao hiem
7|neu cham tra phi bao hiem
7|neu tra cham phi bao hiem
7|Se the nao neu toi cham tra phi bh
7|cham tra phi bh
7|tra cham phi
7|tra cham phi bh
7|neu cham phi bh
7|neu cham tra phi bh
7|neu tra cham phi bh
8|Phi bao hiem cua toi co tang sau moi nam khong
8|tang phi bao hiem
8|tang phi bao hiem hang nam
8|phi bao hiem tang hang nam
8|phi bao hiem tang moi nam
8|moi nam tang phi bao hiem
8|Phi bh cua toi co tang sau moi nam khong
8|tang phi bh
8|tang phi bh hang nam
8|phi bh tang hang nam
8|phi bh tang moi nam
8|moi nam tang phi bh
9|Se the nao neu toi lam mat giay to hop dong bao hiem
9|mat giay to bao hiem
9|mat hop dong bao hiem
9|mat giay to hop dong bao hiem
9|hop dong bao hiem mat
9|hop dong bao hiem bi mat
9|giay to hop dong bao hiem bi mat
9|Se the nao neu toi lam mat giay to hop dong bh
9|mat giay to bh
9|mat hop dong bh
9|mat giay to hop dong bh
9|hop dong bh mat
9|hop dong bh bi mat
9|giay to hop dong bh bi mat
9|Se the nao neu toi lam mat giay to hd bh
9|mat giay to bh
9|mat hd bh
9|mat giay to hd bh
9|hd bh mat
9|hd bh bi mat
9|giay to hd bh bi mat
10|Mẫu đơn ỦY QUYỀN XÁC MINH THÔNG TIN
10|mau don uy quyen xac minh thong tin
10|mẫu đơn uỷ quyền xác minh thông tin
10|don uy quyen xac minh thong tin
10|don uỷ quyền xác minh thông tin
10|don xac minh thong tin
10|đơn Ủy quyền xác minh thông tin
10|mẫu yeu cau xac minh thong tin
10|mau yeu cau xac minh thong tin
11|Phiếu yêu cầu giải quyết quyền lợi bảo hiểm
11|PHIẾU YÊU CẦU GIẢI QUYẾT QUYỀN LỢI BẢO HIỂM
11|yêu cầu giải quyết quyền lợi bảo hiểm
11|yêu cầu giải quyết quyền lợi bảo hiểm
11|yeu cau giai quyet quyen loi
11|yeu cau giai quyet bao hiem
11|yêu cầu giải quyết bảo hiểm
11|yeu cau giai quyet quyen loi bao hiem
11|don yêu cầu giải quyết quyền lợi
11|don yeu cau giai quyet quyen loi
11|don yeu cau giai quyet bao hiem
11|đơn yêu cầu giải quyết bảo hiểm
11|mau giai quyet quyen loi bao hiem
11|don giai quyet quyen loi bao hiem
11|phieu giai quyet quyen loi bao hiem
12|phiếu Điều chỉnh thông tin hợp đồng bảo hiểm
12|phiếu Điều chỉnh thông tin hợp đồng bảo hiểm
12|đơn điều chỉnh thông tin hợp đồng bảo hiểm
12|don dieu chinh thong tin hop dong
12|don dieu chinh thong tin hop dong bao hiem
12|phieu dieu chinh thong tin hop dong bao hiem
12|phieu dieu chinh thong tin hop dong
12|don dieu chinh hop dong
12|don dieu chinh hop dong bao hiem
12|don dieu chinh thong tin bao hiem
12|mau dieu chinh hop dong
12|mau dieu chinh hop dong bao hiem
12|mau dieu chinh thong tin bao hiem
12|mẫu Điều chỉnh thông tin hợp đồng bảo hiểm
11|Phiếu yêu cầu giải quyết quyền lợi bh
11|PHIẾU YÊU CẦU GIẢI QUYẾT QUYỀN LỢI BH
11|yêu cầu giải quyết quyền lợi bh
11|yêu cầu giải quyết quyền lợi bh
11|yeu cau giai quyet quyen loi
11|yeu cau giai quyet bh
11|yêu cầu giải quyết bh
11|yeu cau giai quyet quyen loi bh
11|don yêu cầu giải quyết quyền lợi
11|don yeu cau giai quyet quyen loi
11|don yeu cau giai quyet bh
11|đơn yêu cầu giải quyết bh
11|mau giai quyet quyen loi bh
11|don giai quyet quyen loi bh
11|phieu giai quyet quyen loi bh
12|phiếu Điều chỉnh thông tin hợp đồng bh
12|phiếu Điều chỉnh thông tin hợp đồng bh
12|đơn điều chỉnh thông tin hợp đồng bh
12|don dieu chinh thong tin hop dong
12|don dieu chinh thong tin hop dong bh
12|phieu dieu chinh thong tin hop dong bh
12|phieu dieu chinh thong tin hop dong
12|don dieu chinh hop dong
12|don dieu chinh hop dong bh
12|don dieu chinh thong tin bh
12|mau dieu chinh hop dong
12|mau dieu chinh hop dong bh
12|mau dieu chinh thong tin bh
12|mẫu Điều chỉnh thông tin hợp đồng bh
13|Muc phi bao hiem
13|Muc phi bao hiem
13|Phai dong bao nhieu
13|Phai dong bao nhieu hang thang
13|Phai dong bao nhieu hang nam
13|So tien phai dong
13|Tien phai dong
13|Phai nop bao nhieu
13|Phi tham gia the nao
14|thuong tat toan bo vinh vien
14|thuong tat toan bo vinh vien la gi
14|thuong tat toan phan vinh vien la gi
14|thuong tat the nao thi duoc xem la thuong tat toan bo vinh vien
15|Thuong tat mot phan vinh vien
15|Thuong tat mot phan vinh vien la sao
15|thuong tat the nao thi duoc xem la thuong tat mot phan vinh vien
16|Tai nan la gi
16|The nao duoc coi la tai nan
16|Tai nan
16|Tai nan duoc hieu the nao
17|Tai nan giao thong cong cong